{
  "apiVersion": "powerfarm.specs/v0",
  "budgetBytes": 60000,
  "capturedAt": "2026-09-16T10:51:50Z",
  "cards": [],
  "compiler": {
    "digest": "sha256:09d20418162e1343f46fc268887367c63777e245ac247d8e472c4a5ac480334b",
    "mediaType": "application/json",
    "size": 334
  },
  "context": {
    "digest": "sha256:3fe7d6dc73760750b0aa0c376053b9bdef4c53a23bb488b0a29ffae9af81d64a",
    "mediaType": "text/plain",
    "size": 53937
  },
  "intelligence": "xai/grok-4.6",
  "kind": "WakePack",
  "mandatory": [
    {
      "content": {
        "digest": "sha256:a93f2460f85e622f132b359f6ff93dfbeea6c2387185ed19690b6f9562af2c30",
        "mediaType": "application/json",
        "size": 886
      },
      "reason": "required to exercise the current mandate",
      "role": "contracts"
    },
    {
      "content": {
        "digest": "sha256:fd90755b2ad0fcb27c5b99da75a62c9e6e3a3b894de86afccf01ce2dec4e8783",
        "mediaType": "application/json",
        "size": 373
      },
      "reason": "required to exercise the current mandate",
      "role": "authority"
    },
    {
      "content": {
        "digest": "sha256:51c2e8e217dc82b6b2000efc5287309a7680a5773f21684b032dd97a9143ee99",
        "mediaType": "application/json",
        "size": 160
      },
      "reason": "required to exercise the current mandate",
      "role": "constraints"
    },
    {
      "content": {
        "digest": "sha256:f7ccc09c4fa38b765756dba55a28cdf16149a74cb507f4a59115c736f6e473f7",
        "mediaType": "application/json",
        "size": 307
      },
      "reason": "required to exercise the current mandate",
      "role": "state"
    },
    {
      "content": {
        "digest": "sha256:b1da128e7a6db58cb86b1a4197ed28d49ce0fedec871fdaa8ede87340ac9bfc5",
        "mediaType": "application/json",
        "size": 32457
      },
      "reason": "required to exercise the current mandate",
      "role": "test-source"
    },
    {
      "content": {
        "digest": "sha256:8f3f6b3e4030387f81900eb1a165cb000956c5571e34f64f63ee9bb68387e569",
        "mediaType": "application/json",
        "size": 15208
      },
      "reason": "required to exercise the current mandate",
      "role": "requirements"
    },
    {
      "content": {
        "digest": "sha256:3eede746c4b8dac8d92332a1b69f7b58c086cfa821abe7ba76577353bebbb818",
        "mediaType": "application/json",
        "size": 2877
      },
      "reason": "required to exercise the current mandate",
      "role": "current-dataset"
    }
  ],
  "omitted": [],
  "optional": [],
  "responsibility": {
    "generation": 1,
    "id": "powerfarm.app/contract/exec.build-powerfarm"
  },
  "template": {
    "digest": "sha256:b5d20136fb4130456654b267abe825f5f7dd2271618cdc4b537af79498c9becb",
    "mediaType": "text/plain",
    "size": 894
  },
  "turnId": "b53d29a5df9d2183ef4a6c4faed0fb317341b6882adcd6c4c531640b29c65d05",
  "usedBytes": 53937
}
